,news_url,image_url,title,text,source_name,date,topics,sentiment,type,tickers
0,https://www.cnbc.com/2019/05/31/elon-musk-spacex-is-now-worth-more-than-tesla.html,https://cdn.snapi.dev/images/v1/2/n/105468700-1537838864256gettyimages-1035233996.jpeg,Elon Musk's SpaceX is now worth more than Tesla,Elon Musk's re-usable rocket venture is now worth more than his electric car company.,CNBC,"Fri, 31 May 2019 16:00:00 -0400",[],Neutral,Article,['TSLA']
1,https://www.investopedia.com/auto-stocks-seen-getting-crushed-as-trade-war-expands-to-mexico-4689112,https://cdn.snapi.dev/images/v1/a/u/auto1.jpg,Auto Stocks Seen Getting Crushed As Trade War Expands To Mexico,"Already down sharply in May, shares of automakers could fall 10% further.",Investopedia,"Fri, 31 May 2019 14:57:01 -0400",[],Negative,Article,"['F', 'FCAU', 'GM', 'TSLA']"
2,https://www.cnbc.com/2019/05/31/tesla-promotes-lower-priced-china-made-model-3-in-sales-push.html,https://cdn.snapi.dev/images/v1/z/3/105924582-1558438127923gettyimages-1078753190.jpeg,Tesla promotes lower priced China-made Model 3 in sales push,"U.S. electric vehicle (EV) maker Tesla said on Friday it would price its China-made Model 3 vehicles from $47,529, 13% cheaper than those it currently imports.",CNBC,"Fri, 31 May 2019 06:32:00 -0400",[],Negative,Article,['TSLA']
3,https://feedproxy.google.com/~r/InvestorPlace/~3/U9Fp0EA9HyM/,https://cdn.snapi.dev/images/v1/j/q/tesla-capital-raisejpgquality90stripall.jpg,Here’s How Troublesome Tesla Stock Could Plummet To $100 Or Less,Think it's crazy that TSLA stock could drop another 50% or more? Think again.,InvestorPlace,"Fri, 31 May 2019 05:16:38 -0400",[],Negative,Article,['TSLA']
4,https://feedproxy.google.com/~r/Techcrunch/~3/wtcWBfLGXJY/,https://cdn.snapi.dev/images/v1/o/b/gettyimages-1044441350jpegw601.jpg,Tesla’s new China-made Model 3 opens for pre-order with a 13% price cut,Tesla’s big bet on China-based production is key to a new effort to lure Chinese consumers with cheaper prices. Today the U.S.,TechCrunch,"Fri, 31 May 2019 02:16:26 -0400",[],Positive,Article,['TSLA']
5,https://feeds.reuters.com/~r/reuters/businessNews/~3/JTVWE7dhia4/tesla-prices-china-made-model-3-at-328000-yuan-idUSKCN1T101R,https://cdn.snapi.dev/images/v1/m/h/m02d20190531t2i1392685020rlynxnpef4u00tw640.jpg,"Tesla prices China-made Model 3 at 328,000 yuan","U.S. electric vehicle (EV) maker Tesla Inc said on Friday it would price its China-made Model 3 vehicles from 328,000 yuan ($47,529), as it pushes production and sales in the world's largest new-energy vehicle market.",Reuters,"Thu, 30 May 2019 20:22:00 -0400",[],Neutral,Article,['TSLA']
6,https://seekingalpha.com/article/4267339-teslas-model-s-refresh-little-late?source=feed,https://cdn.snapi.dev/images/v1/b/d/auto12.jpg,Tesla's Model S Refresh Is Too Little Too Late,"On May 29, reports from Tesla insiders surfaced suggesting that the Model S and Model X would receive a full refresh in September.",Seeking Alpha,"Thu, 30 May 2019 13:58:06 -0400",[],Neutral,Article,['TSLA']
7,https://www.investopedia.com/apple-tesla-raytheon-seen-taking-hit-on-rare-earth-shortages-4688904,https://cdn.snapi.dev/images/v1/e/t/etf16-25.jpg,"Apple, Tesla, Raytheon Seen Taking Hit On Rare Earth Shortages",A large number of U.S. companies will be at risk if China curbs exports of rare earth materials.,Investopedia,"Thu, 30 May 2019 13:41:26 -0400",[],Negative,Article,"['AAPL', 'RTN', 'TSLA']"
8,https://feeds.benzinga.com/~r/benzinga/~3/enoo72inj8A/barclays-cuts-tesla-price-target-to-150,https://cdn.snapi.dev/images/v1/4/a/6tt.jpg,Barclays Cuts Tesla Price Target To $150,"Tesla Inc (NASDAQ: TSLA) shares are trading at their lowest levels since 2016, and one analyst said Thursday there may still be more downside ahead.",Benzinga,"Thu, 30 May 2019 09:33:48 -0400",[],Negative,Article,['TSLA']
9,https://www.youtube.com/watch?v=aLWlZ7A_syg,https://cdn.snapi.dev/images/v1/t/e/tes62-2.jpg,Tesla Price Target Slashed to $150 by Barclays Analyst,"Tesla Inc. was likened to a ""niche luxury"" carmaker by Barclays analyst Brian Johnson as he dropped his price target to $150. Bloomberg Opinion columnist Brooke Sutherland reports on ""Bloomberg Daybreak: Americas."" Her opinions are her own.",Bloomberg Markets and Finance,"Thu, 30 May 2019 08:30:15 -0400",[],Negative,Video,['TSLA']
10,https://feeds.reuters.com/~r/reuters/businessNews/~3/FYsJJInZWbE/exclusive-tesla-woes-send-panasonics-u-s-solar-cells-to-philippines-idUSKCN1T017C,https://cdn.snapi.dev/images/v1/n/b/m02d20190530t2i1392478953rlynxnpef4t13iw640.jpg,Exclusive: Tesla woes send Panasonic's U.S. solar cells to Philippines,"Most of the solar cells made by Panasonic at Tesla Inc's New York manufacturing plant are being purchased by H.R.D. Singapore's factories in the Philippines, a chief supplier of panels to Japanese eco-homebuilder Ichijo Co Ltd, two sources familiar with the arrangement said.",Reuters,"Thu, 30 May 2019 07:05:25 -0400",[],Neutral,Article,"['TSLA', 'PCRFY']"
11,https://www.cnbc.com/2019/05/30/barclays-says-tesla-is-stalling-as-a-niche-automaker.html,https://cdn.snapi.dev/images/v1/y/j/tesla-17.jpg,Barclays says Tesla is 'stalling as a niche automaker' and cuts its price target to $150,Barclays lowered its price target on Tesla by 22% on Thursday.,CNBC,"Thu, 30 May 2019 06:21:00 -0400",[],Neutral,Article,['TSLA']
12,https://feedproxy.google.com/~r/InvestorPlace/~3/qiO9ENSwcNw/,https://cdn.snapi.dev/images/v1/z/p/model-3-0.jpg,"Could The Model Y Save Struggling Tesla Stock? Yes, But It’ll Take More","Tesla stock had a really bad start to calendar 2019. But, the Tesla Model S refresh will make the ending much better than the beginning.",InvestorPlace,"Thu, 30 May 2019 05:01:35 -0400",[],Positive,Article,['TSLA']
13,https://www.fool.com/investing/2019/05/29/teslas-biggest-bull-just-posted-its-valuation-mode.aspx?source=iedfolrf0000001,https://cdn.snapi.dev/images/v1/q/g/urlhttps3a2f2fgfoolcdncom2feditorial2fimages2f5269632fmodel-3-presskit-herojpgw700opresize.jpg,Tesla's Biggest Bull Just Posted Its Valuation Model -- and There's a Huge Flaw in It,ARK Invest posted its valuation of Tesla. Here’s what’s wrong with it.,The Motley Fool,"Wed, 29 May 2019 22:18:00 -0400",[],Positive,Article,['TSLA']
14,https://www.fool.com/investing/2019/05/29/after-hours-teslas-musk-reassures-and-veevas-victo.aspx?source=iedfolrf0000001,https://cdn.snapi.dev/images/v1/w/3/urlhttps3a2f2fgfoolcdncom2feditorial2fimages2f5272302ftesla-roadsterjpgw700opresize.jpg,Tesla's Musk Reassures,The electric car specialist's staff gets another hang-in-there message from its CEO.,The Motley Fool,"Wed, 29 May 2019 21:05:00 -0400",['CEO'],Negative,Article,['TSLA']
15,https://www.cnbc.com/2019/05/29/read-tesla-ceo-elon-musk-email-on-vehicle-deliveries-meetings.html,https://cdn.snapi.dev/images/v1/9/y/105786681-1552323674808gettyimages-1128344984.jpeg,Read Tesla CEO Elon Musk's latest email urging employees to improve vehicle deliveries,"On Wednesday, a new email from Tesla CEO Elon Musk to all employees asked them to focus on making end-of-quarter deliveries better than they have been, and called for new meetings with delivery teams every two days ""to understand what's needed.""",CNBC,"Wed, 29 May 2019 17:13:00 -0400",['CEO'],Neutral,Article,['TSLA']
16,https://feeds.benzinga.com/~r/benzinga/~3/cSKoaFaGl1E/another-musk-email-leak-continues-to-hint-at-possible-record-sales,https://cdn.snapi.dev/images/v1/t/e/tesla-22.jpg,Another Musk Email Leak Continues To Hint At Possible Record Sales,"Tesla Inc. shares closed higher Wednesday after a second leaked email from CEO Elon Musk alluded to strong deliveries, but with a caution about an ongoing delivery crunch.",Benzinga,"Wed, 29 May 2019 16:36:06 -0400",[],Negative,Article,['TSLA']
17,https://feeds.reuters.com/~r/reuters/businessNews/~3/gOPGPOxUhco/tesla-ceo-urges-employees-to-catch-up-to-hit-delivery-record-idUSKCN1SZ2KR,https://cdn.snapi.dev/images/v1/k/v/m02d20190529t2i1392247998rlynxnpef4s1ntw640.jpg,Tesla CEO urges employees to 'catch up' to hit delivery record,"Tesla Inc has ""a lot of catching up"" to do but still can achieve a record quarter, Chief Executive Officer Elon Musk wrote in a new email that was reviewed by Reuters.",Reuters,"Wed, 29 May 2019 16:14:23 -0400",['CEO'],Negative,Article,['TSLA']
18,https://seekingalpha.com/article/4267119-greenlight-capital-re-tesla-brings-einhorn-hero-zero-back?source=feed_tag_long_ideas,https://cdn.snapi.dev/images/v1/e/t/etf16-24.jpg,Greenlight Capital Re: Tesla Brings Einhorn From Hero To Zero And Back,Greenlight Capital Re’s first quarter results were a disappointment due to insurance losses.,Seeking Alpha,"Wed, 29 May 2019 16:14:06 -0400",['earnings'],Negative,Article,"['GLRE', 'TSLA']"
19,https://feeds.marketwatch.com/~r/marketwatch/marketpulse/~3/l9Z2l1zGKKA/story.aspx,https://cdn.snapi.dev/images/v1/i/h/model-3-red.jpg,Elon Musk's latest leaked email: Tesla must catch up on deliveries,"Tesla Inc. Chief Executive Elon Musk on Wednesday emailed employees that the electric-car maker has ""a lot of vehicle deliveries to catch up to in order to have a successful quarter,"" according to a report by Bloomberg News.",Market Watch,"Wed, 29 May 2019 16:11:01 -0400",[],Negative,Article,['TSLA']
20,https://feeds.reuters.com/~r/reuters/businessNews/~3/r-gVjv-9NGg/tesla-needs-to-catch-up-on-deliveries-electrek-citing-musks-leaked-email-idUSKCN1SZ2KR,https://cdn.snapi.dev/images/v1/z/j/m02d20190529t2i1392247998rlynxnpef4s1ntw640.jpg,"Tesla needs to catch up on deliveries: Electrek, citing Musk's leaked email","Tesla Inc has ""a lot of catching up"" to do in order to achieve a record quarter, news website Electrek reported on Wednesday, citing Chief Executive Officer Elon Musk's leaked email to employees.",Reuters,"Wed, 29 May 2019 15:45:06 -0400",[],Neutral,Article,['TSLA']
21,https://seekingalpha.com/article/4267104-tesla-real-indicator-demand?source=feed,https://cdn.snapi.dev/images/v1/x/c/auto16.jpg,Tesla: The Real Indicator Of Demand,Pointing out potential flaws with using Google Search and Alexa for demand analysis.,Seeking Alpha,"Wed, 29 May 2019 15:08:55 -0400",[],Neutral,Article,['TSLA']
22,https://www.investopedia.com/will-tesla-be-taken-over-by-ford-apple-or-toyota-4688794,https://cdn.snapi.dev/images/v1/e/t/etf27-14.jpg,"Will Tesla Be Taken Over by Ford, Apple or Toyota?",NYU professor Scott Galloway says CEO Elon Musk may be forced to sell Tesla as the stock falls by half.,Investopedia,"Wed, 29 May 2019 14:01:34 -0400",[],Neutral,Article,"['AAPL', 'F', 'TM', 'TSLA']"
23,https://seekingalpha.com/article/4267046-tesla-musks-twitter-warning?source=feed,https://cdn.snapi.dev/images/v1/e/z/441.jpg,Tesla: Musk's Twitter Warning,CEO replies to CleanTechnica article.,Seeking Alpha,"Wed, 29 May 2019 12:32:30 -0400",[],Negative,Article,['TSLA']
24,https://seekingalpha.com/article/4267030-teslas-catastrophic-miscalculation?source=feed,https://cdn.snapi.dev/images/v1/l/b/ts6-1.jpg,Tesla's Catastrophic Miscalculation,"The recent Tesla capital raise can only be described as the actions of a panicked CEO, backed into a corner of his own making.",Seeking Alpha,"Wed, 29 May 2019 12:10:21 -0400",[],Negative,Article,['TSLA']
25,https://feeds.marketwatch.com/~r/marketwatch/marketpulse/~3/HA05ukAnItM/story.aspx,https://cdn.snapi.dev/images/v1/k/w/model-3-at-2jpgw712.jpg,Tesla 'rejigging' California plant to make way for Model Y: report,"Tesla Inc. TSLA, -1.00% has been ""rejigging"" its Fremont, Calif., factory to accommodate Model Y production as well as a Model S refresh, according to a report on CNBC Wednesday that cited current and former unnamed employees.",Market Watch,"Wed, 29 May 2019 11:54:03 -0400",[],Neutral,Article,['TSLA']
26,https://feeds.reuters.com/~r/reuters/businessNews/~3/LYaH6VGndF0/outside-of-tesla-future-ev-sales-in-u-s-may-be-thin-for-most-brands-study-idUSKCN1SZ20I,https://cdn.snapi.dev/images/v1/j/5/m02d20190529t2i1392189490rlynxnpef4s198w640.jpg,"Outside of Tesla, future EV sales in U.S. may be thin for most brands: study","U.S. demand for electric vehicles, including hybrids, could rise to 1.28 million by 2026, a new study projected on Wednesday, but most brands will struggle to make money on the new models.",Reuters,"Wed, 29 May 2019 11:53:38 -0400",[],Neutral,Article,"['TSLA', 'DMLRY', 'F', 'GM', 'VWAGY']"
27,https://seekingalpha.com/article/4267031-tesla-real-world-reinforcement-learning-scale?source=feed_tag_long_ideas,https://cdn.snapi.dev/images/v1/m/z/fremont-13.jpg,Tesla And Real World Reinforcement Learning At Scale,The near-term feasibility of self-driving cars depends on the limits of current machine learning approaches. This article is about using reinforcement learning to solve path planning and driving policy.,Seeking Alpha,"Wed, 29 May 2019 11:42:53 -0400",[],Neutral,Article,['TSLA']
28,https://www.youtube.com/watch?v=xlk7LjB_log&t=335s,https://cdn.snapi.dev/images/v1/t/s/ts72.jpg,Jim Cramer's Weighing In on Tesla (Stock of the Day),"Jim Cramer tackles the headlines of the day from the bond yields to China weaponizing its rare earth dominance and, finally, why that matters for Tesla.",The Street,"Wed, 29 May 2019 11:30:35 -0400",['cramer'],Negative,Video,['TSLA']
29,https://feedproxy.google.com/~r/typepad/RyNm/~3/tC8tDR3EYc8/,https://cdn.snapi.dev/images/v1/u/7/shutterstock-496664848jpgquality90stripall.jpg,"Tesla Set to Price China-Built Model 3, Make Changes to California Assembly Line","Electric vehicle maker Tesla Inc. (NASDAQ: TSLA) reportedly is overhauling its Fremont, California, assembly lines to prepare for production of the company’s new Model Y sport utility vehicle/crossover beginning later this year.",24/7 Wall Street,"Wed, 29 May 2019 11:05:08 -0400",[],Neutral,Article,['TSLA']
30,https://www.cnbc.com/2019/05/29/tesla-fremont-factory-prepping-for-model-y-production-model-s-refresh.html,https://cdn.snapi.dev/images/v1/2/o/105797044-1556035025463preview.jpg,Tesla is rejiggering its Fremont factory to build the Model Y SUV and a Model S refresh,Starting up production of the Model Y in 2019 allows Tesla to tap into the growing SUV segment sooner rather than later.,CNBC,"Wed, 29 May 2019 09:07:00 -0400",[],Neutral,Article,['TSLA']
31,https://seekingalpha.com/article/4266750-tesla-fall-35?source=feed,https://cdn.snapi.dev/images/v1/9/x/tes7.jpg,Tesla Could Fall To $35,Vehicle production and deliveries are on the decline in 2019.,Seeking Alpha,"Wed, 29 May 2019 08:00:08 -0400",[],Negative,Article,['TSLA']
32,https://www.cnbc.com/2019/05/29/tesla-rallied-90percent-the-last-time-it-suffered-a-pullback-of-this-size.html,https://cdn.snapi.dev/images/v1/4/s/498.jpg,Tesla rallied 90% the last time it suffered a pullback of this size,"Tesla shares have broken down in the middle of their worst pullback ever, and one analyst says they could fall further before finding a bottom.",CNBC,"Wed, 29 May 2019 08:00:00 -0400",['tanalysis'],Positive,Article,['TSLA']
33,https://feedproxy.google.com/~r/InvestorPlace/~3/x2vUfh30pNA/,https://cdn.snapi.dev/images/v1/f/k/t2-3.jpg,Lyft and Uber Have a Big Lesson for Tesla,"Elon Musk is betting that TSLA stock will see gains from an autonomous ride-hailing option, but it will also lead to low margins.",InvestorPlace,"Wed, 29 May 2019 07:51:12 -0400",[],Neutral,Article,['TSLA']
34,https://www.fool.com/investing/2019/05/28/tesla-to-make-a-surprise-announcement-in-china.aspx?source=iedfolrf0000001,https://cdn.snapi.dev/images/v1/r/9/urlhttps3a2f2fgfoolcdncom2feditorial2fimages2f5271162ftesla-china-announcementpngw700opresize.jpg,Tesla to Make a Surprise Announcement in China,What will Tesla announce on Friday?,The Motley Fool,"Tue, 28 May 2019 21:45:00 -0400",[],Positive,Article,['TSLA']
35,https://www.fool.com/investing/2019/05/28/tesla-demand-is-strong.aspx?source=iedfolrf0000001,https://cdn.snapi.dev/images/v1/y/6/urlhttps3a2f2fgfoolcdncom2feditorial2fimages2f5272442ftesla-model-s-x-demand-dtq9cokpngw700opresize.jpg,"Tesla: ""Demand Is Strong""","Production and delivery logistics -- not demand -- are the main challenges Tesla faces in its efforts to achieve record quarterly vehicle deliveries, CEO Elon Musk says.",The Motley Fool,"Tue, 28 May 2019 19:41:00 -0400",[],Positive,Article,['TSLA']
36,https://seekingalpha.com/article/4266889-tesla-melting?source=feed_tag_long_ideas,https://cdn.snapi.dev/images/v1/r/9/0x600-17.jpg,Tesla Is Melting,Tesla's stock has been cut in half since the company's highs of last year.,Seeking Alpha,"Tue, 28 May 2019 18:06:25 -0400",[],Negative,Article,['TSLA']
37,https://www.youtube.com/watch?v=5BI1lnomlB0,https://cdn.snapi.dev/images/v1/t/s/ts6a2.jpg,Tesla Slump Reflects Growing Skepticism of Company Vision,Tesla CEO Elon Musk said 2019 would bring an affordable electric car built in a new factory in China.,Wall Street Journal,"Tue, 28 May 2019 16:55:06 -0400",[],Negative,Video,['TSLA']
38,https://feedproxy.google.com/~r/BusinessRss/~3/bDnBSXknrmQ/,https://cdn.snapi.dev/images/v1/n/i/niotes72.jpg,This Chinese Electric Car Maker Has Just Heaped Even More Pressure On Tesla,"Electric car maker Nio advanced after the Chinese Tesla rival posted better-than-expected Q1 earnings, as ES8 deliveries rose despite a fall in subsidies.",Investors Business Daily,"Tue, 28 May 2019 11:13:12 -0400",[],Neutral,Article,"['TSLA', 'NIO']"
39,https://www.investopedia.com/tesla-stock-could-punish-complacent-short-sellers-4688665,https://cdn.snapi.dev/images/v1/x/g/m02d20190521t2i1389388770rlynxnpef4k0q5w640.jpg,Tesla Stock Could Punish Complacent Short Sellers,Tesla shares have reached hidden support after a major breakdown and could rally 40 to 60 points in the coming weeks.,Investopedia,"Tue, 28 May 2019 09:47:36 -0400",['tanalysis'],Positive,Article,['TSLA']
40,https://feedproxy.google.com/~r/InvestorPlace/~3/QgqNHmemTzU/,https://cdn.snapi.dev/images/v1/e/q/amsi8.jpg,"Tuesday’s Vital Data: Roku, Tesla and Amazon","Options trading was buzzing in Roku, Tesla and Amazon on Friday. Here are the metrics that matter moving forward.",InvestorPlace,"Tue, 28 May 2019 09:31:50 -0400",[],Neutral,Article,"['AMZN', 'ROKU', 'TSLA']"
41,https://www.cnbc.com/2019/05/28/teslas-china-made-model-3-may-be-priced-in-43400-50700-range-bloomberg.html,https://cdn.snapi.dev/images/v1/e/r/105924582-1558438127923gettyimages-1078753190.jpeg,"Tesla's China-made Model 3 reportedly may be priced in the $43,400 to $50,700 range","Tesla is considering pricing its China-manufactured Model 3 vehicles between $43,431 and $50,670 before subsidies.",CNBC,"Tue, 28 May 2019 07:00:00 -0400",[],Neutral,Article,['TSLA']
42,https://feeds.reuters.com/~r/reuters/businessNews/~3/e0R5aBfaM7g/teslas-china-made-model-3-may-be-priced-in-43400-50700-range-bloomberg-idUSKCN1SY0NE,https://cdn.snapi.dev/images/v1/o/z/m02d20190528t2i1391705559rlynxnpef4r0hdw640.jpg,"Tesla's China-made Model 3 may be priced in $43,400-$50,700 range: Bloomberg","Tesla Inc is considering pricing its China-manufactured Model 3 vehicles between 300,000 yuan and 350,000 yuan ($43,431-$50,670) before subsidies, Bloomberg reported on Tuesday, citing people familiar with the matter.",Reuters,"Tue, 28 May 2019 03:57:14 -0400",[],Neutral,Article,['TSLA']
43,https://seekingalpha.com/article/4266686-tesla-theories-gravity?source=feed,https://cdn.snapi.dev/images/v1/s/2/ts6a.jpg,Tesla: Theories Of Gravity,Tesla investors appear in wide variety in this market - from the recklessly believing to the irredeemably hateful.,Seeking Alpha,"Mon, 27 May 2019 20:51:03 -0400",[],Neutral,Article,['TSLA']
44,https://www.fool.com/investing/2019/05/27/3-surprising-stocks-hitting-new-lows-last-week.aspx?source=iedfolrf0000001,https://cdn.snapi.dev/images/v1/e/t/etf16-21.jpg,Surprising Stocks Hitting New Lows Last Week,"Former market darlings Weibo, Tesla, and Blue Apron dropped to 52-week lows.",The Motley Fool,"Mon, 27 May 2019 12:00:00 -0400",[],Negative,Article,"['APRN', 'TSLA', 'WB']"
45,https://www.zacks.com/stock/news/420242/why-tesla-stock-remains-a-strong-sell,https://cdn.snapi.dev/images/v1/4/4/441-2.jpg,Why Tesla Stock Remains A Strong Sell,There are too many challenges ahead for this one-time high-flyer and valuation needs to be much more reasonable before an entry can be recommended.,Zacks Investment Research,"Mon, 27 May 2019 11:36:00 -0400",[],Negative,Article,['TSLA']
46,https://www.fool.com/investing/2019/05/26/is-tesla-doomed.aspx?source=iedfolrf0000001,https://cdn.snapi.dev/images/v1/7/l/urlhttps3a2f2fgfoolcdncom2feditorial2fimages2f5268172ftesla-model-sjpgw700opresize.jpg,Is Tesla Doomed?,Demand for the electric-vehicle pioneer's products is cooling off. Yet there are two potential catalysts that could get Tesla moving in the right direction again.,The Motley Fool,"Sun, 26 May 2019 12:30:00 -0400",[],Negative,Article,['TSLA']
47,https://www.fool.com/investing/2019/05/26/why-tesla-should-abandon-solar-energy-right-now.aspx?source=iedfolrf0000001,https://cdn.snapi.dev/images/v1/y/f/urlhttps3a2f2fgfoolcdncom2feditorial2fimages2f5263722fpress-solar-roofjpgw700opresize.jpg,Why Tesla Should Abandon Solar Energy,"Solar energy hasn't worked out as planned for Tesla, and the company needs to remove the distraction from the business.",The Motley Fool,"Sun, 26 May 2019 11:34:00 -0400",[],Negative,Article,['TSLA']
48,https://www.fool.com/investing/2019/05/25/why-i-just-bought-tesla-stock.aspx?source=iedfolrf0000001,https://cdn.snapi.dev/images/v1/m/o/model-3-at-2jpgw712.jpg,Why I Just Bought Tesla Stock,"The electric-car maker is trading at a multiyear low, but the bull case is still clear.",The Motley Fool,"Sat, 25 May 2019 10:13:00 -0400",[],Positive,Article,['TSLA']
49,https://www.youtube.com/watch?v=Lm8renclGBc,https://cdn.snapi.dev/images/v1/t/e/tes6-12.jpg,Tesla finishes wild week in red after some bearish calls from Wall Street,"A resilient Tesla bull speaks out, in spite of the company's very bad week.",CNBC Television,"Fri, 24 May 2019 17:50:18 -0400",[],Negative,Video,['TSLA']
